code,name
32518,Other basic inorganic chemical manufacturing
32519,Other basic organic chemical manufacturing
32521,Resin and synthetic rubber manufacturing
32522,Artificial and synthetic fibres and filaments manufacturing
32531,Fertilizer manufacturing
32532,Pesticide and other agricultural chemical manufacturing
32541,Pharmaceutical and medicine manufacturing
32551,Paint and coating manufacturing
32552,Adhesive manufacturing
32561,Soap and cleaning compound manufacturing
32562,Toilet preparation manufacturing
32591,Printing ink manufacturing
32592,Explosives manufacturing
32599,All other chemical product manufacturing
32611,Plastic packaging materials and unlaminated film and sheet manufacturing
32612,Plastic pipe pipe fitting and unlaminated profile shape manufacturing
32613,Laminated plastic plate sheet (except packaging) and shape manufacturing
32614,Polystyrene foam product manufacturing
32615,Urethane and other foam product (except polystyrene) manufacturing
32616,Plastic bottle manufacturing
32619,Other plastic product manufacturing
32621,Tire manufacturing
32622,Rubber and plastic hose and belting manufacturing
32629,Other rubber product manufacturing
32711,Pottery ceramics and plumbing fixture manufacturing
32712,Clay building material and refractory manufacturing
32721,Glass and glass product manufacturing
32731,Cement manufacturing
32732,Ready-mix concrete manufacturing
32733,Concrete pipe brick and block manufacturing
32739,Other concrete product manufacturing
32741,Lime manufacturing
32742,Gypsum product manufacturing
32791,Abrasive product manufacturing
32799,All other non-metallic mineral product manufacturing
33111,Iron and steel mills and ferro-alloy manufacturing
33121,Iron and steel pipes and tubes manufacturing from purchased steel
33122,Rolling and drawing of purchased steel
33131,Alumina and aluminum production and processing
33141,Non-ferrous metal (except aluminum) smelting and refining
33142,Copper rolling drawing extruding and alloying
33149,Non-ferrous metal (except copper and aluminum) rolling drawing	extruding and alloying
33151,Ferrous metal foundries
33152,Non-ferrous metal foundries
33211,Forging and stamping
33221,Cutlery and hand tool manufacturing
33231,Plate work and fabricated structural product manufacturing
33232,Ornamental and architectural metal product manufacturing
33241,Power boiler and heat exchanger manufacturing
33242,Metal tank (heavy gauge) manufacturing
33243,Metal can box and other metal container (light gauge) manufacturing
33251,Hardware manufacturing
33261,Spring and wire product manufacturing
33271,Machine shops
33272,Turned product and screw nut and bolt manufacturing
33281,Coating engraving cold and heat treating and allied activities
33291,Metal valve manufacturing
33299,All other fabricated metal product manufacturing
33311,Agricultural implement manufacturing
33312,Construction machinery manufacturing
33313,Mining and oil and gas field machinery manufacturing
33324,Industrial machinery manufacturing
33331,Commercial and service industry machinery manufacturing
33341,Ventilation heating air-conditioning and commercial refrigeration equipment manufacturing
33351,Metalworking machinery manufacturing
33361,Engine turbine and power transmission equipment manufacturing
33391,Pump and compressor manufacturing
33392,Material handling equipment manufacturing
33399,All other general-purpose machinery manufacturing
33411,Computer and peripheral equipment manufacturing
33421,Telephone apparatus manufacturing
33422,Radio and television broadcasting and wireless communications equipment manufacturing
33429,Other communications equipment manufacturing
33431,Audio and video equipment manufacturing
33441,Semiconductor and other electronic component manufacturing
33451,Navigational measuring medical and control instruments manufacturing
33461,Manufacturing and reproducing magnetic and optical media
33513,Electric lighting equipment manufacturing
33521,Small electrical appliance manufacturing
33522,Major appliance manufacturing
33531,Electrical equipment manufacturing
33591,Battery manufacturing
33592,Communication and energy wire and cable manufacturing
33593,Wiring device manufacturing
33599,All other electrical equipment and component manufacturing
33611,Automobile and light-duty motor vehicle manufacturing
33612,Heavy-duty truck manufacturing
33621,Motor vehicle body and trailer manufacturing
33631,Motor vehicle gasoline engine and engine parts manufacturing
33632,Motor vehicle electrical and electronic equipment manufacturing
33633,Motor vehicle steering and suspension components (except spring) manufacturing
33634,Motor vehicle brake system manufacturing
33635,Motor vehicle transmission and power train parts manufacturing
33636,Motor vehicle seating and interior trim manufacturing
33637,Motor vehicle metal stamping
33639,Other motor vehicle parts manufacturing
33641,Aerospace product and parts manufacturing
33651,Railroad rolling stock manufacturing
33661,Ship and boat building
33699,Other transportation equipment manufacturing
33711,Wood kitchen cabinet and counter top manufacturing
33712,Household and institutional furniture manufacturing
33721,Office furniture (including fixtures) manufacturing
33791,Mattress manufacturing
33792,Blind and shade manufacturing
33911,Medical equipment and supplies manufacturing
33991,Jewellery and silverware manufacturing
33992,Sporting and athletic goods manufacturing
33993,Doll toy and game manufacturing
33994,Office supplies (except paper) manufacturing
33995,Sign manufacturing
33999,All other miscellaneous manufacturing
41111,Live animal merchant wholesalersCAN
41112,Oilseed and grain merchant wholesalersCAN
41113,Nursery stock and plant merchant wholesalersCAN
41119,Other farm product merchant wholesalersCAN
41211,Petroleum petroleum products and other hydrocarbons merchant wholesalersCAN
41311,General-line food merchant wholesalersCAN
41312,Dairy and milk products merchant wholesalersCAN
41313,Poultry and egg merchant wholesalersCAN
41314,Fish and seafood product merchant wholesalersCAN
41315,Fresh fruit and vegetable merchant wholesalersCAN
41316,Red meat and meat product merchant wholesalersCAN
41319,Other specialty-line food merchant wholesalersCAN
41321,Non-alcoholic beverage merchant wholesalersCAN
41322,Alcoholic beverage merchant wholesalersCAN
41331,Cigarette and tobacco product merchant wholesalersCAN
41341,Cannabis merchant wholesalers
41411,Clothing and clothing accessories merchant wholesalersCAN
41412,Footwear merchant wholesalersCAN
41413,Piece goods notions and other dry goods merchant wholesalersCAN
41421,Home entertainment equipment merchant wholesalersCAN
41422,Household appliance merchant wholesalersCAN
41431,China glassware crockery and pottery merchant wholesalersCAN
41432,Floor covering merchant wholesalersCAN
41433,Linen drapery and other textile furnishings merchant wholesalersCAN	
41439,Other home furnishings merchant wholesalersCAN
41441,Jewellery and watch merchant wholesalersCAN
41442,Book periodical and newspaper merchant wholesalersCAN
41443,Photographic equipment and supplies merchant wholesalersCAN
41444,Sound recording merchant wholesalersCAN
41445,Video recording merchant wholesalersCAN
41446,Toy and hobby goods merchant wholesalersCAN
41447,Amusement and sporting goods merchant wholesalersCAN
41451,Pharmaceuticals and pharmacy supplies merchant wholesalersCAN
41452,Toiletries cosmetics and sundries merchant wholesalersCAN
41511,New and used automobile and light-duty truck merchant wholesalersCAN
41512,Truck truck tractor and bus merchant wholesalersCAN
41519,Recreational and other motor vehicles merchant wholesalersCAN
41521,Tire merchant wholesalersCAN
41529,Other new motor vehicle parts and accessories merchant wholesalersCAN
41531,Used motor vehicle parts and accessories merchant wholesalersCAN
41611,Electrical wiring and construction supplies merchant wholesalersCAN
41612,Plumbing heating and air-conditioning equipment and supplies merchant wholesalersCAN
41621,Metal service centresCAN
41631,General-line building supplies merchant wholesalersCAN
41632,Lumber plywood and millwork merchant wholesalersCAN
41633,Hardware merchant wholesalersCAN
41634,Paint glass and wallpaper merchant wholesalersCAN
41639,Other specialty-line building supplies merchant wholesalersCAN
41711,Farm lawn and garden machinery and equipment merchant wholesalersCAN
41721,Construction and forestry machinery equipment and supplies merchant wholesalersCAN
41722,Mining and oil and gas well machinery equipment and supplies merchant wholesalersCAN
41723,Industrial machinery equipment and supplies merchant wholesalersCAN
41731,Computer computer peripheral and pre-packaged software merchant wholesalersCAN	
41732,Electronic components navigational and communications equipment and supplies merchant wholesalersCAN
41791,Office and store machinery and equipment merchant wholesalersCAN
41792,Service establishment machinery equipment and supplies merchant wholesalersCAN
41793,Professional machinery equipment and supplies merchant wholesalersCAN
41799,All other machinery equipment and supplies merchant wholesalersCAN
41811,Recyclable metal merchant wholesalersCAN
41812,Recyclable paper and paperboard merchant wholesalersCAN
41819,Other recyclable material merchant wholesalersCAN
41821,Stationery and office supplies merchant wholesalersCAN
41822,Other paper and disposable plastic product merchant wholesalersCAN
41831,Agricultural feed merchant wholesalersCAN
41832,Seed merchant wholesalersCAN
41839,Agricultural chemical and other farm supplies merchant wholesalersCAN
41841,Chemical (except agricultural) and allied product merchant wholesalersCAN
41851,Mineral ore and precious metal merchant wholesalersCAN
41861,Log wood chips and other wood products merchant wholesalersCAN
41893,Second-hand goods (except machinery and automotive) merchant wholesalersCAN
41899,All other merchant wholesalersCAN
41911,Business-to-business electronic marketsUS
41912,Wholesale trade agents and brokersUS
44111,New car dealersUS
44112,Used car dealersUS
44121,Recreational vehicle dealersUS
44122,Motorcycle boat and other motor vehicle dealersUS
44133,Automotive parts and accessories retailersUS
44134,Tire dealersUS
44411,Home centresUS
44412,Paint and wallpaper retailersUS
44414,Hardware retailersUS
44418,Other building material dealersUS
44423,Outdoor power equipment retailersUS
44424,Nursery retailers and garden centresUS
44511,Supermarkets and other grocery retailers (except Convenience retailers)US
44513,Convenience retailers and vending machine operatorsUS
44523,Fruit and vegetable marketsUS
44524,Meat marketsUS
44525,Fish and seafood marketsUS
44529,Other specialty food retailersUS
44532,Beer wine and liquor retailersUS
44911,Furniture retailersUS
44912,Floor covering window treatment and other home furnishing retailersUS
44921,Electronics and appliances retailersUS
45511,Department storesUS
45521,Warehouse clubs Supercentres and other general merchandise retailersUS
45611,Pharmacies and drug storesUS
45612,Cosmetics beauty supplies and perfume retailersUS	
45613,Optical goods retailersUS
45619,Other health and personal care retailersUS
45711,Gasoline stations with convenience storesUS
45712,Other gasoline stationsUS
45721,Fuel dealersUS
45811,Clothing and clothing accessories retailersUS
45821,Shoe retailersUS
45831,Jewellery retailersUS
45832,Luggage and leather goods retailersUS
45911,Sporting goods retailersUS
45912,Hobby toy and game retailersUS
45913,Sewing needlework and piece goods retailersUS
45914,Musical instrument and supplies retailersUS
45921,Book retailers and news dealersUS
45931,FloristsUS
45941,Office supplies and stationery retailersUS
45942,Gift novelty and souvenir retailersUS
45951,Used merchandise retailersUS
45991,Pet and pet supplies retailersUS
45992,Art dealersUS
45993,Manufactured (mobile) home dealersUS
45999,All other miscellaneous retailersUS
48111,Scheduled air transportation
48121,Non-scheduled air transportation
48211,Rail transportation
48311,Deep sea coastal and Great Lakes water transportation
48321,Inland water transportation
48411,General freight trucking local
48412,General freight trucking long distance
48421,Used household and office goods moving
48422,Specialized freight (except used goods) trucking local
48423,Specialized freight (except used goods) trucking long distance
48511,Urban transit systems
48521,Interurban and rural bus transportation
48531,Taxi service
48532,Limousine service
48541,School and employee bus transportation
48551,Charter bus industry
48599,Other transit and ground passenger transportation
48611,Pipeline transportation of crude oil
48621,Pipeline transportation of natural gas
48691,Pipeline transportation of refined petroleum products
48699,All other pipeline transportation
48711,Scenic and sightseeing transportation land
48721,Scenic and sightseeing transportation water
48799,Scenic and sightseeing transportation other
48811,Airport operations
48819,Other support activities for air transportation
48821,Support activities for rail transportation
48831,Port and harbour operations
48832,Marine cargo handling
48833,Navigational services to shipping
48839,Other support activities for water transportation
48841,Motor vehicle towing
48849,Other support activities for road transportation
48851,Freight transportation arrangement
48899,Other support activities for transportation
49111,Postal service
49211,Couriers
49221,Local messengers and local delivery
49311,General warehousing and storage
49312,Refrigerated warehousing and storage
49313,Farm product warehousing and storage
49319,Other warehousing and storage
51211,Motion picture and video production
51212,Motion picture and video distribution
51213,Motion picture and video exhibition
51219,Post-production and other motion picture and video industries
51223,Music publishers
51224,Sound recording studios
51225,Record production and distribution
51229,Other sound recording industries
51311,Newspaper publishers
51312,Periodical publishers
51313,Book publishers
51314,Directory and mailing list publishers
51319,Other publishers
51321,Software publishers
51611,Radio broadcasting stations
51612,Television broadcasting stations
51621,Media streaming distribution services and other media networks and content providers
51731,Wired and wireless telecommunications carriers (except satellite)CAN
51741,Satellite telecommunications
51791,Other telecommunicationsCAN
51821,Computing infrastructure providers data processing web hosting and related services
51921,Libraries and archives
51929,Web search portals and all other information services
52111,Monetary authorities
52211,BankingCAN
52213,Credit unionsUS
52219,Other depository credit intermediationUS
52221,Credit card issuingUS
52222,Sales financingUS
52229,Other non-depository credit intermediationUS
52231,Mortgage and non-mortgage loan brokersUS
52232,Financial transactions processing reserve and clearing house activitiesUS
52239,Other activities related to credit intermediationUS
52311,Investment banking and securities dealingUS
52312,Securities brokerageUS
52313,Commodity contracts dealingUS
52314,Commodity contracts brokerageUS
52321,Securities and commodity exchanges
52391,Miscellaneous intermediationUS
52392,Portfolio managementUS
52393,Investment adviceUS
52399,All other financial investment activitiesUS
52411,Direct life health and medical insurance carriersUS
52412,Direct insurance (except life health and medical) carriersUS
52413,Reinsurance carriersUS
52421,Insurance agencies and brokeragesUS
52429,Other insurance related activitiesUS
52611,Pension fundsCAN
52691,Open-end investment fundsCAN
52693,Segregated (except pension) fundsCAN
52698,All other funds and financial vehiclesCAN
53111,Lessors of residential buildings and dwellingsUS
53112,Lessors of non-residential buildings (except mini-warehouses)US
53113,Self-storage mini-warehousesUS
53119,Lessors of other real estate propertyUS
53121,Offices of real estate agents and brokers
53131,Real estate property managersUS
53132,Offices of real estate appraisersUS
53139,Other activities related to real estateUS
53211,Passenger car rental and leasing
53212,Truck utility trailer and recreational vehicle (RV) rental and leasing
53221,Consumer electronics and appliance rental
53228,All other consumer goods rental
53231,General rental centres
53241,Construction transportation mining	and forestry machinery and equipment rental and leasing
53242,Office machinery and equipment rental and leasing
53249,Other commercial and industrial machinery and equipment rental and leasing
53311,Lessors of non-financial intangible assets (except copyrighted works)
54111,Offices of lawyers
54112,Offices of notaries
54119,Other legal services
54121,Accounting tax preparation bookkeeping and payroll services
54131,Architectural services
54132,Landscape architectural services
54133,Engineering services
54134,Drafting services
54135,Building inspection services
54136,Geophysical surveying and mapping services
54137,Surveying and mapping (except geophysical) services
54138,Testing laboratories
54141,Interior design services
54142,Industrial design services
54143,Graphic design services
54149,Other specialized design services
54151,Computer systems design and related services
54161,Management consulting services
54162,Environmental consulting services
54169,Other scientific and technical consulting services
54171,Research and development in the physical engineering and life sciences
54172,Research and development in the social sciences and humanities
54181,Advertising agencies
54182,Public relations services
54183,Media buying agencies
54184,Media representatives
54185,Display advertising
54186,Direct mail advertising
54187,Advertising material distribution services
54189,Other services related to advertising
54191,Marketing research and public opinion polling
54192,Photographic services
54193,Translation and interpretation services
54194,Veterinary services
54199,All other professional scientific and technical services
55111,Management of companies and enterprises
56111,Office administrative services
56121,Facilities support services
56131,Employment placement agencies and executive search services
56132,Temporary help services
56133,Professional employer organizations
56141,Document preparation services
56142,Telephone call centres
56143,Business service centres
56144,Collection agencies
56145,Credit bureaus
56149,Other business support services
56151,Travel agencies
56152,Tour operators
56159,Other travel arrangement and reservation services
56161,Investigation guard and armoured car services
56162,Security systems services
56171,Exterminating and pest control services
56172,Janitorial services
56173,Landscaping services
56174,Carpet and upholstery cleaning services
56179,Other services to buildings and dwellings
56191,Packaging and labelling services
56192,Convention and trade show organizers
56199,All other support services
56211,Waste collectionUS
56221,Waste treatment and disposalUS
56291,Remediation servicesUS
56292,Material recovery facilitiesUS
56299,All other waste management servicesUS
61111,Elementary and secondary schoolsUS
61121,Community colleges and C.E.G.E.P.s
61131,Universities
61141,Business and secretarial schools
61142,Computer training
61143,Professional and management development training
61151,Technical and trade schools
61161,Fine arts schools
61162,Athletic instruction
61163,Language schools
61169,All other schools and instruction
61171,Educational support services
62111,Offices of physicians
62121,Offices of dentists
62131,Offices of chiropractors
62132,Offices of optometrists
62133,Offices of mental health practitioners (except physicians)
62134,Offices of physical occupational and speech therapists and audiologists
62139,Offices of all other health practitioners
62141,Family planning centres
62142,Out-patient mental health and substance use centres
62149,Other out-patient care centres
62151,Medical and diagnostic laboratories
62161,Home health care services
62191,Ambulance services
62199,All other ambulatory health care services
62211,General medical and surgical hospitals
62221,Psychiatric and substance use hospitals
62231,Specialty hospitals (except psychiatric and substance use)
62311,Nursing care facilities
62321,Residential facilities for persons with a developmental disability
62322,Residential facilities for persons with a mental health or substance use condition
62331,Community care facilities for the elderly
62399,Other residential care facilities
62411,Child and youth services
62412,Services for the elderly and persons with a disability
62419,Other individual and family services
62421,Community food services
62422,Community housing services
62423,Emergency and other relief services
62431,Vocational rehabilitation services
62441,Child day-care services
71111,Theatre companies and dinner theatres
71112,Dance companies
71113,Musical groups and artists
71119,Other performing arts companies
71121,Spectator sports
71131,Promoters (presenters) of performing arts sports and similar events with facilities
71132,Promoters (presenters) of performing arts sports and similar events without facilities
71141,Agents and managers for artists athletes entertainers and other public figures
71151,Independent artists writers and performers
71211,Museums
71212,Historic and heritage sites
71213,Zoos and botanical gardens
71219,Nature parks and other similar institutions
71311,Amusement and theme parks
71312,Amusement arcades
71321,Casinos (except casino hotels)
71329,Other gambling industries
71391,Golf courses and country clubs
71392,Skiing facilities
71393,Marinas
71394,Fitness and recreational sports centres
71395,Bowling centres
71399,Other amusement and recreation industries
72111,Hotels (except casino hotels) and motels
72112,Casino hotels
72119,Other traveller accommodation
72121,Recreational vehicle (RV) parks and recreational camps
72131,Rooming and boarding houses
72231,Food service contractors
72232,Caterers
72233,Mobile food services
72241,Drinking places (alcoholic beverages)
72251,Full-service restaurants and limited-service eating places
81111,Automotive mechanical and electrical repair and maintenance
81112,Automotive body paint interior and glass repair
81119,Other automotive repair and maintenance
81121,Electronic and precision equipment repair and maintenance
81131,Commercial and industrial machinery and equipment (except automotive and electronic) repair and maintenance
81141,Home and garden equipment and appliance repair and maintenance
81142,Reupholstery and furniture repair
81143,Footwear and leather goods repair
81149,Other personal and household goods repair and maintenance
81211,Hair care and esthetic servicesUS
81219,Other personal care servicesUS
81221,Funeral homesUS
81222,Cemeteries and crematoriaUS
81231,Coin-operated laundries and dry cleanersUS
81232,Dry cleaning and laundry services (except coin-operated)US
81233,Linen and uniform supplyUS
81291,Pet care (except veterinary) servicesUS
81292,Photo finishing servicesUS
81293,Parking lots and garagesUS
81299,All other personal servicesUS
81311,Religious organizationsUS
81321,Grant-making and giving servicesUS
81331,Social advocacy organizationsUS
81341,Civic and social organizationsUS
81391,Business associationsUS
81392,Professional organizationsUS
81393,Labour organizationsUS
81394,Political organizationsUS
81399,Other membership organizationsUS
81411,Private households
91111,Defence servicesCAN
91121,Federal courts of lawCAN
91122,Federal correctional servicesCAN
91123,Federal police servicesCAN
91124,Federal regulatory servicesCAN
91129,Other federal protective servicesCAN
91131,Federal labour and employment servicesCAN
91132,Immigration servicesCAN
91139,Other federal labour employment and immigration servicesCAN
91141,Foreign affairsCAN
91142,International assistanceCAN
91191,Other federal government public administrationCAN
91211,Provincial courts of lawCAN
91212,Provincial correctional servicesCAN
91213,Provincial police servicesCAN
91214,Provincial fire-fighting servicesCAN
91215,Provincial regulatory servicesCAN
91219,Other provincial protective servicesCAN
91221,Provincial labour and employment servicesCAN
91291,Other provincial and territorial public administrationCAN
91311,Municipal courts of lawCAN
91312,Municipal correctional servicesCAN
91313,Municipal police servicesCAN
91314,Municipal fire-fighting servicesCAN
91315,Municipal regulatory servicesCAN
91319,Other municipal protective servicesCAN
91391,Other local municipal and regional public administrationCAN
91411,Indigenous public administrationCAN
91911,International and other extra-territorial public administrationCAN
111110,Soybean farming
111120,Oilseed (except soybean) farmingUS
111130,Dry pea and bean farmingUS
111140,Wheat farming
111150,Corn farmingUS
111160,Rice farming
111190,Other grain farmingCAN
111211,Potato farmingUS
111219,Other vegetable (except potato) and melon farmingUS
111310,Orange groves
111320,Citrus (except orange) grovesUS
111330,Non-citrus fruit and tree nut farmingCAN
111411,Mushroom productionUS
111412,Cannabis grown under cover
111419,Other food crops grown under coverUS
111421,Nursery and tree productionUS
111422,Floriculture productionUS
111910,Tobacco farming
111920,Cotton farming
111930,Sugar cane farming
